Unidade,Empreendimento,Nome_Comprador,Data_Nascimento,Nacionalidade,Profissao,RG,CPF/CNPJ,Estado_Civil,Data_Casamento,Regime,Telefone,Email,Endereço
F6,COLINAS DO PARAHYBA,TAMIRES CURSINO MARCONDES,14/12/1990,BRASILEIRA,RECEPCIONISTA,47156148 SSP/SP,381.675.238-10,CASADO(A),26/03/2014,COMUNHÃO PARCIAL DE BENS,(12) 99671-6889,tamirescursino@hotmail.com,"Rua Benedito Domingues de Souza, 141, Parque Vera Cruz, Tremembé, SP, 12.120-000"
F3,Colinas do Parahyba,JAMES ANDERSON MORAES,02/02/1979,Brasileira,Funcionário(a) Público(a) Estadual,32630003-X SSP/SP,215.023.498-09,Casado(a),24/01/2009,Comunhão Parcial de Bens após a Lei 6.515/77,(12) 991624741,jamesmoraes79@hotmail.com,"Rodovia Alvaro Barbosa de Lima Neto, 2530, Rua 3n.75, Guedes, Tremembé, SP, 12.125-800"
F9,COLINAS DO PARAHYBA,HELIO DE CASTRO E SOUZA,13/04/1940,BRASILEIRA,APOSENTADO,4323279 SSP/SP,168.900.438-04,CASADO(A),02/01/1965,"COMUNHÃO UNIVERSAL DE BENS, ANTERIOR A LEI 6.515/77",(12) 99164-3549,heliojunior@cotet.com.br,"Rua das Duquesas, Nº 191, Campos do Conde 3, Tremembé, SP, 12.125-352"
F10,COLINAS DO PARAHYBA,HELIO DE CASTRO E SOUZA,13/04/1940,BRASILEIRA,APOSENTADO,4323279 SSP/SP,168.900.438-04,CASADO(A),02/01/1965,"COMUNHÃO UNIVERSAL DE BENS, ANTERIOR A LEI 6.515/77",(12) 99164-3549,heliojunior@cotet.com.br,"Rua das Duquesas, Nº 191, Campos do Conde 3, Tremembé, SP, 12.125-352"
F11,COLINAS DO PARAHYBA,JESSICA GABRIELA SOARES RIBEIRO,26/06/1990,BRASILEIRA,TÉCNICO(A) EM ENFERMAGEM,34950806 SSP/SP,389.352.868-77,CASADO(A),25/05/2021,COMUNHÃO PARCIAL DE BENS,(12) 974061290,annaluisaribeiro91@yahoo.com.br,"Avenida Arnaldo Felipe Sbruzzi, 275, apto 103, bloco 17, Piracangaguá, Taubaté, SP, 12.042-210"
F12,COLINAS DO PARAHYBA,WILIAN BATISTA DOS SANTOS,14/01/1989,BRASILEIRA,OPERADOR DE EQUIPAMENTOS,45749712 SSP/SP,357.947.878-80,CASADO(A),10/08/2012,COMUNHÃO PARCIAL DE BENS,(12) 99176-2552,wilian.batista.santos@gmail.com,"Rua José Hermínio da Silva, 134, Chácara do Visconde, Taubaté, SP, 12.050-453"
F13,COLINAS DO PARAHYBA,JOSÉ GERALDO PETERSEN FILHO,23/03/1983,BRASILEIRA,MILITAR,43547137 SSP/SP,297.125.598-07,Solteiro(a),XXXXXXXX,União estável com XXXXXXXXXX,(12) 991726817,geraldoceliapetersen@hotmail.com,"Rua Jose Francisco de Oliveira, nº 177, Centro (Tremembé), Tremembé, SP, 12.125-128"
F14,COLINAS DO PARAHYBA,LUIZ ROBERTO SANT ANA JÚNIOR,26/06/1978,BRASILEIRO,ADESTRADOR,33101063 SSP/SP,272.213.338-58,DIVORCIADO(A),XXXXXXXX,XXXXXXXX,(12) 974026935,santana.robertinho@hotmail.com,"Estrada do Corredor, n.º 4811, Jardim Luana, Itaquaquecetuba, SP, 08.586-000"
